Sentence,Lesson
Il a lu.,7
Il a mal.,5
Il y a le lama.,5
Il a sali le sol.,8
Il a le lasso.,8
Il a semé le lama.,9
Il a lavé le sas.,10
Il a vissé la vis.,13
Le vélo a sali le sol.,10
Il va à la villa.,10
Il y a le mari.,11
Il va sur Mars.,11
Il a râlé.,11
Il a survolé Mars.,11
Il va ouvrir la villa.,12
Le sou a roulé sur le sol.,12
Il a réussi.,11
La souris se mit sur le lit.,13
Il se lave.,13
Il y va à vélo.,10
La sonnerie a sonné.,13
La louve salue la Lune.,13
Le narval va sous le navire.,13
Le lilas orne le mur.,13
Il lit le menu.,13
Il a nourrit le lama.,13
Il rit.,13
La loi du roi fut dure.,21
Ma tata m'a amenée à la foire.,21
Papy pédale à vélo !,20
Papa part à vélo.,20
La pie a lâché une jolie plume.,20
Je lis le titre du livre.,19
La cascade coule de la roche.,22
La clé ouvre la porte.,22
Je suis très rapide !,23
Ouvre la fenêtre.,23
La fête a duré toute la nuit.,23
Il aura la crêpe à la banane.,31
La farine se prépare à partir du blé.,24
Le crabe se balade sur la sable.,24
Je lis à ma copine.,22
Le bébé a bu tout le bol de soupe,24
Le tigre chasse la biche.,25
Le cheval galope à toute allure.,25
La pirogue a chaviré sous la vague.,25
La dame porte une jolie bague.,25
Je suis ravi de te voir !,21
Papa conduira le gros camion.,26
Le dragon survole la tour.,26
Ne gratte pas le bouton sur ton bras.,26
Ils font du café.,26
Le chat noir ronronne sur le canapé.,26
Mamie tricote un pull.,22
Apporte ton ballon !,26
Ne taquine pas ta copine !,27
Il va venir.,13
La poule remue sa plume.,20
Il joue une ballade sur sa guitare.,25
Le bouchon se bloque.,27
Tu es très fort ! ,37
Il est très fort !,28
Il est pas à la boutique.,28
Il est rapide.,28
Tu es triste.,37
Il est triste.,28
Tu es sorti.,37
Il est sorti.,28
Il gravit lentement la pente.,29
Le vent souffle fort sur la colline.,29
Je me brosse les dents,37
Qui est de retour.,28
Papi regarde un film à la télé.,25
Il sèche la tâche sur sa manche.,30
La taupe vit sous le sol.,31
Le judoka enfile son kimono.,32
Je sais lire !,33
Le lutin plante des carottes dans le jardin.,34
La tarte sent si bon.,29
Je vide les ordures.,37
Il a cassé une tasse.,22
La mouette a volé nos chips.,37
Je retourne la terre avec une pelle.,37
Enfile ta veste.,37
Il a perdu sa clé.,37
La vache vit animal à la ferme.,37
Quelle chance! ,38
Nous allons avec papy pour les vacances.,38
Tu dessines un carré.,37
Le sol est couvert de glace.,38
Le cyclone souffle fort sur le port.,38
Les soldats ont été pris dans une embuscade.,40
La petite courut vers sa maman.,37
Papa remue la soupe.,20
Il allume sa lampe dans sa chambre.,41
Elle coupe des tranches de jambon cru.,41
Le bébé est un amour.,28
Le bambou pousse dans la jungle.,41
Nous avons décoré ma chambre.,41
Il joue du trombone,42
On coupe les pommes pour la compote.,42
La pomme est bonne.,28
Le rôti cuit au four.,31
La cloche sonne minuit.,22
Bonne nuit.,24
Son père lui raconte un conte de fées.,26
Écoute la chanson à la radio.,30
La lionne chasse la gazelle.,37
Le lion garde sa tribu.,26
Elle est impolie.,43
Maman a ajouté un brin de romarin au ragoût.,34
Il est malin.,34
Elle a étendu le linge sur la corde.,44
Je suis allé à un spectacle de magie.,44
Elle a rempli le vase de roses.,45
La fusée décolle de la Terre.,45
Elle a compris la ruse.,45
Je me suis assis à table.,24
Mon cousin est venu pour les vacances.,45
Nous allons en vacances à la plage.,44
Tu as cinq ans.,38
Il a noué le fil fort sur le mât.,15
Le lilas a fané.,15
Il a fini le livre.,15
Le fruit a mûri.,15
Il a vu le film.,15
Il a mis une affiche sur le mur.,16
Flore se mouche.,16
La machine marche.,16
Le marché ouvre.,16
Le chat a filé sous le char.,16
La vache mâche le chou.,16
Je me réjouis ! ,17
Je lis le journal.,17
Je suis ravi !,17
Le chat chasse la souris.,16
Je marche sur la dune.,18
Il nous a donné de la limonade.,18
Je me suis douché.,18
La marmotte dort toute la journée.,19
Il dort toute la journée.,19
Finis ta tartine.,19
Voilà une idée !,21
Il admire la lune.,18
Allons jouer au ballon dans le parc.,46
Nous irons au parc.,31
Papa m'a offert un bouquet de muguet.,48
Ferme les volets.,48
Elle a attrapé un poisson dans le filet.,48
La dame mange la tarte.,44
Les dames mangent la tarte,49
Le bébé ne dort pas.,24
Les bébés ne dorment pas.,49
Le bus roule dans la rue.,30
Les bus roulent dans la rue.,49
Le chat grimpe.,43
Les chats grimpent.,49
Je me sèche avec une serviette.,37
Le corbeau est un oiseau.,49
Mon frère a un an.,30
Ceci est un message confidentiel !,56
Le bébé boit son biberon.,26
Il commande la crêpe fourrée de chocolat.,30
Elle est parti en taxi.,51
Tu as mangé trop de bonbons.,54
Mamie est malade.,28
Le cygne flotte sur la mare.,52
Les vignes poussent dans le vignoble.,52
Mon cousin est un guignol !,52
Viens chez moi !,53
Venez chez moi !,53
Tu manges au restaurant.,44
Vous mangez au restaurant.,53
Tu marches vite.,19
Vous marchez vite.,53
Le marchand vend des légumes sur le marché.,54
Le filet de poisson grille dans le four.,54
Le vieux chien se repose.,47
Maman a attaché ses longs cheveux.,54
Il a gagné un trophée au tennis.,52
Le phare éclaire le chemin des bateaux.,49
Nous payons le loyer.,58
Je balaie les miettes sur le sol.,37
Envoyez la lettre par la poste.,58
Le pêcheur a attrapé plein de seiches dans son filet.,48
Notre équipe a reçu une médaille.,38
Le bouilloire siffle.,15
Il a voulu réussir.,12
Il ouvre la valse.,13
Il a vu le navire sur la rive.,13
Une alarme sonne.,13
Le rat vit sous la ville.,13
À minuit il sort.,13
Il avale une olive.,13
Le cheval a chassé le chat.,16
Allume la radio.,18
Il se mouche.,16
Tu sorti le chat.,19
Il a déjà fini le livre.,18
Le chat a attrapé une truite.,20
La poule picore.,22
Ma copine coupe la carotte.,22
Le jour se lève.,23
Papa va à la douche.,20
Il se prépare vite.,20
Il boit à sa gourde.,25
Coupe le légume.,25
Le bus arrive.,24
Apporte ton livre.,26
On a la quiche pour le déjeuner.,46
Tu es à la boutique.,37
Tu es rapide.,37
Regarde par la vitre.,25
Le téléski nous remonte sur la piste de ski.,32
La météo est glacée en ce moment.,38
Je dessine un cercle.,38
Nous irons écouter un concert.,46
Il a renversé du jus sur son pantalon.,37
Mon cousin est mignon.,52
Un noyer pousse dans mon jardin.,58
Il y a le métro.,19
Écoute la dame qui parle.,27
Silence pendant que nous regardons le film.,38
Vous devez prendre le bus.,53
Elle adore manger des frites sur la plage.,46
Il a joué un domino.,18
Papa paie le loyer.,58
Le petit chien noir mange son os. Il va aboyer si le chat arrive.,58
